{
  "stageFormat": 1,
  "version": "2.0.0-beta.10",
  "productCommit": "07158893bc6bfec4ed1a4c2c7b936f8d8b349efe",
  "kitBootstrap": {
    "unixEngineCommit": "8ac85e063fea08069ab6ef260525c48aa03338b4",
    "windowsBootstrapCommit": "8ac85e063fea08069ab6ef260525c48aa03338b4"
  },
  "serverEditions": {
    "server": {
      "image": "ghcr.io/michaelzelbel/godspeed-mission-control@sha256:7446dfa65454ab82ebc80cb610123de9579b5fcdfa5d1b1ff9e7c717b8419d0f"
    }
  },
  "windowsSetup": {
    "file": "GodspeedSetup.exe",
    "releaseTag": "candidate/2.0.0-beta.10",
    "sha256": "e8d82ca0ffd95d8d46608d581ae0a201179703d200686dd659e118076c1b8d26"
  },
  "addons": {
    "godspeed-coach": "b134abffccb7fe7b33f4d971c802db8d1ff4f00f",
    "godspeed-headache": "30dc063286c0f95e7fe68ab03b0c03321a1e2465",
    "godspeed-journal": "6d810f457a78606e2a0bc778b0bb9f366311ae80",
    "mc-phone": "ceab2992233c6f360accb1542624fcf527a22df8",
    "mc-video": "fecb22dd6f0376ebec810fa733a50eb880484f2e"
  },
  "previous": {
    "version": "2.0.0-beta.9",
    "stageCommit": "9406f67ee293df2209d6d5dc1a19788e11a47808"
  },
  "withdrawn": []
}
